{
  "set": "part2-core",
  "part": 2,
  "version": 1,
  "entries": [
    {
      "id": "l2-0001",
      "set": "part2-core",
      "part": 2,
      "status": "active",
      "question": "Who is responsible for authorizing the travel budget this quarter?",
      "responses": {
        "A": "That falls under the finance director's purview.",
        "B": "Yes, we traveled by train.",
        "C": "To the regional office in Chicago."
      },
      "answer": "A",
      "errorType": "wh-who",
      "explanation": "Câu hỏi \"Who\" tìm người chịu trách nhiệm duyệt ngân sách. Câu đáp nhắc đến \"finance director's purview\" (phạm vi quyền hạn của giám đốc tài chính) là câu trả lời gián tiếp chỉ người chịu trách nhiệm.",
      "trap": "Câu đáp chứa \"traveled by train\" bẫy lặp từ \"travel\" và trả lời Yes/No cho câu hỏi WH. Câu đáp nhắc đến \"Chicago\" bẫy trả lời cho câu hỏi địa điểm \"Where\".",
      "gen": {
        "model": "gemini-3.5-flash",
        "promptVersion": "part2-v2",
        "batch": "2026-09-19",
        "date": "2026-09-19"
      },
      "verify": {
        "model": "gemini-flash-lite-latest",
        "answer": "A",
        "agreed": true
      },
      "audio": {
        "question": "audio/790cfde6dc76f407.mp3",
        "A": "audio/2b92e1f29806bab3.mp3",
        "B": "audio/7b211bbcace67cf0.mp3",
        "C": "audio/1bb90f72d708b42d.mp3"
      },
      "voices": {
        "question": "en-US-GuyNeural",
        "responses": "en-US-JennyNeural"
      }
    },
    {
      "id": "l2-0002",
      "set": "part2-core",
      "part": 2,
      "status": "active",
      "question": "What did the client say about our proposed marketing campaign?",
      "responses": {
        "A": "They want to campaign for local charities.",
        "B": "They're still reviewing the budget breakdown.",
        "C": "At the conference room on the third floor."
      },
      "answer": "B",
      "errorType": "wh-what",
      "explanation": "Câu hỏi \"What\" hỏi về ý kiến của khách hàng đối với chiến dịch marketing. Câu đáp trả lời gián tiếp rằng họ vẫn đang xem xét bảng phân bổ ngân sách nên chưa đưa ra phản hồi chính thức.",
      "trap": "Câu đáp chứa \"campaign for local charities\" bẫy lặp từ \"campaign\" nhưng sai ngữ cảnh. Câu đáp chỉ \"third floor\" bẫy trả lời cho câu hỏi \"Where\".",
      "gen": {
        "model": "gemini-3.5-flash",
        "promptVersion": "part2-v2",
        "batch": "2026-09-19",
        "date": "2026-09-19"
      },
      "verify": {
        "model": "gemini-flash-lite-latest",
        "answer": "B",
        "agreed": true
      },
      "audio": {
        "question": "audio/83c421e235eaab7b.mp3",
        "A": "audio/ef524cda25909458.mp3",
        "B": "audio/4f41004c804ef14d.mp3",
        "C": "audio/68520e3032a23881.mp3"
      },
      "voices": {
        "question": "en-GB-SoniaNeural",
        "responses": "en-GB-RyanNeural"
      }
    },
    {
      "id": "l2-0003",
      "set": "part2-core",
      "part": 2,
      "status": "active",
      "question": "Where should I store these extra promotional brochures?",
      "responses": {
        "A": "We need to promote the new product line.",
        "B": "By the end of the week, hopefully.",
        "C": "The supply closet has some empty shelves."
      },
      "answer": "C",
      "errorType": "wh-where",
      "explanation": "Câu hỏi \"Where\" hỏi nơi cất tài liệu quảng cáo dư thừa. Câu đáp chỉ ra \"supply closet\" (tủ chứa đồ dùng) còn trống kệ là địa điểm lưu trữ phù hợp.",
      "trap": "Câu đáp chứa \"promote\" bẫy lặp từ cùng gốc với \"promotional\". Câu đáp chỉ thời gian \"end of the week\" bẫy trả lời cho câu hỏi \"When\".",
      "gen": {
        "model": "gemini-3.5-flash",
        "promptVersion": "part2-v2",
        "batch": "2026-09-19",
        "date": "2026-09-19"
      },
      "verify": {
        "model": "gemini-flash-lite-latest",
        "answer": "C",
        "agreed": true
      },
      "audio": {
        "question": "audio/09e25a9f4d9f1777.mp3",
        "A": "audio/1e20db472830ac88.mp3",
        "B": "audio/b710e25b3e5b83f4.mp3",
        "C": "audio/8d419fae0d45aaea.mp3"
      },
      "voices": {
        "question": "en-US-JennyNeural",
        "responses": "en-AU-NatashaNeural"
      }
    },
    {
      "id": "l2-0004",
      "set": "part2-core",
      "part": 2,
      "status": "active",
      "question": "When will the building inspector sign off on the renovations?",
      "responses": {
        "A": "As soon as the electrical wiring is completed.",
        "B": "Please sign your name at the bottom.",
        "C": "In the main lobby near the entrance."
      },
      "answer": "A",
      "errorType": "wh-when",
      "explanation": "Câu hỏi \"When\" hỏi thời điểm thanh tra xây dựng ký duyệt sửa chữa. Câu đáp đưa ra mốc thời gian gián tiếp \"ngay khi hệ thống dây điện hoàn thành\".",
      "trap": "Câu đáp chứa \"sign your name\" bẫy lặp từ \"sign\" nhưng sai nghĩa (ký tên thay vì ký duyệt). Câu đáp chỉ địa điểm \"main lobby\" bẫy trả lời cho câu hỏi \"Where\".",
      "gen": {
        "model": "gemini-3.5-flash",
        "promptVersion": "part2-v2",
        "batch": "2026-09-19",
        "date": "2026-09-19"
      },
      "verify": {
        "model": "gemini-flash-lite-latest",
        "answer": "A",
        "agreed": true
      },
      "audio": {
        "question": "audio/69b38961205800bc.mp3",
        "A": "audio/bf699450a52d62b8.mp3",
        "B": "audio/1e0740259887a8da.mp3",
        "C": "audio/a2787db4c34bb4f6.mp3"
      },
      "voices": {
        "question": "en-GB-RyanNeural",
        "responses": "en-US-GuyNeural"
      }
    },
    {
      "id": "l2-0005",
      "set": "part2-core",
      "part": 2,
      "status": "active",
      "question": "Why didn't we receive the shipment of office chairs today?",
      "responses": {
        "A": "Yes, the chairs are very comfortable.",
        "B": "The delivery truck broke down on the highway.",
        "C": "To the warehouse on 5th Avenue."
      },
      "answer": "B",
      "errorType": "wh-why",
      "explanation": "Câu hỏi \"Why\" hỏi lý do tại sao chưa nhận được lô hàng ghế văn phòng. Câu đáp giải thích nguyên nhân do xe tải giao hàng bị hỏng trên đường cao tốc.",
      "trap": "Câu đáp chứa \"chairs\" bẫy lặp từ và trả lời Yes/No cho câu hỏi WH. Câu đáp chỉ địa điểm \"warehouse\" bẫy trả lời cho câu hỏi \"Where\".",
      "gen": {
        "model": "gemini-3.5-flash",
        "promptVersion": "part2-v2",
        "batch": "2026-09-19",
        "date": "2026-09-19"
      },
      "verify": {
        "model": "gemini-flash-lite-latest",
        "answer": "B",
        "agreed": true
      },
      "audio": {
        "question": "audio/32e375218a8f319c.mp3",
        "A": "audio/ffc7a81b1f93a7f1.mp3",
        "B": "audio/d5d86e144e0986f8.mp3",
        "C": "audio/ca7e8a60d1bc9c11.mp3"
      },
      "voices": {
        "question": "en-AU-NatashaNeural",
        "responses": "en-GB-SoniaNeural"
      }
    },
    {
      "id": "l2-0006",
      "set": "part2-core",
      "part": 2,
      "status": "active",
      "question": "How often do we need to update the inventory database?",
      "responses": {
        "A": "It costs about five hundred dollars.",
        "B": "The date of the meeting has changed.",
        "C": "The system does it automatically every midnight."
      },
      "answer": "C",
      "errorType": "wh-how",
      "explanation": "Câu hỏi \"How often\" hỏi về tần suất cập nhật cơ sở dữ liệu kho. Câu đáp trả lời gián tiếp rằng hệ thống tự động làm việc đó mỗi đêm, nghĩa là không cần làm thủ công.",
      "trap": "Câu đáp chứa \"five hundred dollars\" bẫy trả lời cho câu hỏi giá cả \"How much\". Câu đáp chứa \"date\" bẫy đồng âm/gần âm với \"database\".",
      "gen": {
        "model": "gemini-3.5-flash",
        "promptVersion": "part2-v2",
        "batch": "2026-09-19",
        "date": "2026-09-19"
      },
      "verify": {
        "model": "gemini-flash-lite-latest",
        "answer": "C",
        "agreed": true
      },
      "audio": {
        "question": "audio/47cae7b73f2267e2.mp3",
        "A": "audio/3444599d7ccb98a2.mp3",
        "B": "audio/ae66426a2db5e44a.mp3",
        "C": "audio/a5b87dc7dacd7f3b.mp3"
      },
      "voices": {
        "question": "en-US-GuyNeural",
        "responses": "en-US-JennyNeural"
      }
    },
    {
      "id": "l2-0007",
      "set": "part2-core",
      "part": 2,
      "status": "active",
      "question": "Who is leading the orientation session for the new interns?",
      "responses": {
        "A": "I think Sandra from HR is handling that.",
        "B": "It's scheduled for ten o'clock tomorrow.",
        "C": "Please orient the map to the north."
      },
      "answer": "A",
      "errorType": "wh-who",
      "explanation": "Câu hỏi \"Who\" hỏi người dẫn dắt buổi định hướng cho thực tập sinh mới. Câu đáp chỉ ra \"Sandra from HR\" là người xử lý việc đó.",
      "trap": "Câu đáp chứa \"ten o'clock\" bẫy trả lời cho câu hỏi thời gian \"When\". Câu đáp chứa \"orient\" bẫy lặp từ cùng gốc với \"orientation\" nhưng mang nghĩa khác hoàn toàn (định hướng bản đồ).",
      "gen": {
        "model": "gemini-3.5-flash",
        "promptVersion": "part2-v2",
        "batch": "2026-09-19",
        "date": "2026-09-19"
      },
      "verify": {
        "model": "gemini-flash-lite-latest",
        "answer": "A",
        "agreed": true
      },
      "audio": {
        "question": "audio/e3f357bc57775590.mp3",
        "A": "audio/9f891318f9f083e7.mp3",
        "B": "audio/840e2062ff2fc439.mp3",
        "C": "audio/b4c24dde99b1b38c.mp3"
      },
      "voices": {
        "question": "en-GB-SoniaNeural",
        "responses": "en-GB-RyanNeural"
      }
    },
    {
      "id": "l2-0008",
      "set": "part2-core",
      "part": 2,
      "status": "active",
      "question": "What is the policy regarding personal phone calls during work hours?",
      "responses": {